{
  "$schema": "http://json-schema.org/draft-06/schema#",
  "$id": "https://distanthorizon.dev/schemas/hull.schema.json",
  "title": "Hull document",
  "description": "An authored HULL (server/shipclasses/*.json, schema 3): its multi-deck plan kept as raw text rows (deck-plan format v3, docs/deckplan-format.md), the slots modules overlay, the mounts parts hang on, its dry mass, its capability tags and the loadout it ships with (docs/modules.md). Derived from the Gleam decoders in server/src/dh_server/hull.gleam (hull_decoder/cargo_decoder/default_loadout_decoder/tags_decoder) — those decoders are the source of truth; this schema is documentation and a typo-catcher, not a substitute for them. A hull is NOT a resolved ship class: shipclass.gleam decodes the wire form loadout.resolve bakes out of a hull, which carries a required flight block a hull document must never have. additionalProperties is false at every object level even though the decoders themselves ignore unknown fields, precisely so this schema can catch typos the decoders would silently swallow.",
  "type": "object",
  "additionalProperties": false,
  "required": [
    "schema", "id", "name",
    "decks",
    "cargo"
  ],
  "properties": {
    "schema": { "type": "integer" },
    "id": { "type": "string" },
    "name": { "type": "string" },
    "sprite": {
      "type": "string",
      "description": "Art directory under client/assets/ships/. Defaults to the hull id. Mount GEOMETRY lives in that directory's meta.json as a named mount anchor, never here."
    },
    "decks": {
      "type": "array",
      "items": { "$ref": "#/$defs/deck" }
    },
    "consoles": {
      "type": "array",
      "description": "Optional. Derived at load from the grids: h/c/b (helm/cargo/broker) are wall-mounted edge fixtures on the floor tile they face, q (docking port) is a center glyph; the server re-emits this list (namespaced, over the wire) but hand-authored docs omit it.",
      "items": { "$ref": "#/$defs/console" }
    },
    "spawn": { "$ref": "#/$defs/spawn" },
    "cargo": {
      "type": "object",
      "additionalProperties": false,
      "required": ["capacity", "handling"],
      "properties": {
        "capacity": {
          "type": "integer",
          "minimum": 0,
          "description": "Hold size in cargo units. Must be >= 0 (enforced by the Gleam decoder's validate step, not by this schema)."
        },
        "handling": {
          "type": "string",
          "enum": ["breakbulk", "container"],
          "description": "How cargo physically gets aboard: break-bulk hulls load by robot stevedores anywhere; container hulls need a station crane and never open their holds."
        }
      }
    },
    "dock_port_orientation": {
      "type": "number",
      "description": "Optional field (decode.optional_field, default 90). This hull's docking-port outward normal in its own frame, in DEGREES (0 = nose/+x). 90 = port flank (side-on mooring, the default). Combined with a station berth's orientation to fix the moored heading (issue #14)."
    },
    "dock_standoff": {
      "type": "number",
      "description": "Optional field (decode.optional_field, default 20.0). How far this hull's centre stands off the berth mooring line, in tiles (= metres), along the berth's outward normal — the per-ship half of the moored sim pose (issue #31). Authored per class since wide hulls stand off further than narrow ones."
    },
    "mass": {
      "type": "number",
      "description": "Optional field (decode.optional_field, default 100.0; server/src/dh_server/hull.gleam). Dry structural mass — total fit mass = this + every fitted module and part (docs/modules.md, M4)."
    },
    "provides": { "$ref": "#/$defs/tags" },
    "requires": { "$ref": "#/$defs/tags" },
    "mounts": {
      "type": "array",
      "description": "Optional field (decode.optional_field, default []). Exterior attach points parts hang on (docs/modules.md, M4).",
      "items": { "$ref": "#/$defs/mount" }
    },
    "slots": {
      "type": "array",
      "description": "Optional field (decode.optional_field, default []). Modulable interior regions (docs/modules.md, M4). A tile joins a slot by carrying that slot's uppercase letter marker in its CENTRE; everything without a marker is fixed hull structure no module may overwrite.",
      "items": { "$ref": "#/$defs/slot" }
    },
    "default_loadout": {
      "type": "object",
      "description": "Optional field (decode.optional_field). The loadout this hull ships with: slot id -> module id, mount id -> part id.",
      "additionalProperties": false,
      "properties": {
        "modules": {
          "type": "object",
          "additionalProperties": { "type": "string" }
        },
        "parts": {
          "type": "object",
          "additionalProperties": { "type": "string" }
        }
      }
    }
  },
  "$defs": {
    "deck": {
      "type": "object",
      "additionalProperties": false,
      "required": ["name", "grid"],
      "properties": {
        "name": { "type": "string" },
        "grid": {
          "type": "array",
          "description": "3*height rows of 3*width chars: each tile is a 3x3 block. Centre glyph = ' ' floor, '.' void, 'x' stairs, 's' spawn, 'q' docking port, or an uppercase letter naming the slot this tile belongs to — spawn/docking are DERIVED from these glyphs, and slot membership is cross-checked against the hull's own `slots` table. N/E/S/W edge-mids = ' ' open, '#' wall, '=' door, letter fixture — h=helm, c=cargo, b=broker are wall-mounted console fixtures, DERIVED into the consoles list the same way. The NE corner is an optional colour hex digit ('0'-'9', 'a'-'f'); the SW corner carries no data any more (docs/deckplan-format.md). Row count and each row's length must be multiples of 3 and consistent (enforced by the Gleam decoder, not by this schema).",
          "items": { "type": "string" }
        }
      }
    },
    "console": {
      "type": "object",
      "additionalProperties": false,
      "required": ["id", "kind", "x", "y"],
      "properties": {
        "id": { "type": "string" },
        "kind": {
          "type": "string",
          "description": "Free-form in the decoder (e.g. \"helm\"/\"cargo\" are conventions, not constraints); left open here. At least one console of kind \"helm\" is required by the Gleam decoder's validate step, not by this schema."
        },
        "deck": {
          "type": "integer",
          "description": "Which deck index this console sits on (default 0)."
        },
        "x": { "type": "integer" },
        "y": { "type": "integer" }
      }
    },
    "spawn": {
      "type": "object",
      "additionalProperties": false,
      "required": ["tile"],
      "properties": {
        "deck": {
          "type": "integer",
          "description": "Which deck arriving characters appear on (default 0)."
        },
        "tile": {
          "type": "array",
          "description": "[x, y] tile where arriving characters appear (the airlock/gangway end).",
          "items": { "type": "integer" },
          "minItems": 2,
          "maxItems": 2
        }
      }
    },
    "tags": {
      "type": "object",
      "description": "A {tag: amount} object. Tags are open strings the engine only compares and sums (server/src/dh_server/hull.gleam tags_decoder).",
      "additionalProperties": { "type": "integer" }
    },
    "slot": {
      "type": "object",
      "description": "One modulable interior region. Both `marker` and `id` must be unique across a hull's slots — enforced by hull.validate, not by this schema: JSON Schema draft-06 has no way to say \"this property is unique across the items of an array\".",
      "additionalProperties": false,
      "required": ["marker", "id", "name"],
      "properties": {
        "marker": {
          "type": "string",
          "pattern": "^[A-Z]$",
          "description": "The uppercase letter hull tiles carry in their CENTRE to join this slot. Uppercase means slot membership; lowercase says what a tile is."
        },
        "id": {
          "type": "string",
          "description": "What a module names in its own \"slot\" field."
        },
        "name": { "type": "string" }
      }
    },
    "mount": {
      "type": "object",
      "additionalProperties": false,
      "required": ["id", "kind", "size"],
      "properties": {
        "id": { "type": "string" },
        "kind": {
          "type": "string",
          "description": "What sort of part takes this mount — \"engine\" for now."
        },
        "size": {
          "type": "string",
          "enum": ["s", "m", "l"],
          "description": "A mount takes any part of its kind up to this size."
        }
      }
    }
  }
}
