{
  "schema": 3,
  "id": "sparrow",
  "name": "Sparrow",
  "decks": [
    {
      "name": "Main",
      "grid": [
        "               ",
        " .  .  .  .  . ",
        "               ",
        "   #########   ",
        " . #B  B  B# . ",
        "   #           ",
        "               ",
        " . #D     D# . ",
        "   #           ",
        "               ",
        " . #C  C  C# . ",
        "   #           ",
        "               ",
        " . #C  C  C# . ",
        "   #           ",
        "               ",
        " . =q     q= . ",
        "   #########   ",
        "               ",
        " .  .  .  .  . ",
        "               "
      ]
    }
  ],
  "mass": 12.0,
  "provides": { "power": 12 },
  "requires": { "engine": 1 },
  "mounts": [
    { "id": "engine_port",   "kind": "engine", "size": "s" },
    { "id": "engine_center", "kind": "engine", "size": "s" },
    { "id": "engine_stbd",   "kind": "engine", "size": "s" }
  ],
  "slots": [
    { "marker": "B", "id": "cockpit", "name": "Cockpit" },
    { "marker": "C", "id": "bay",     "name": "Pod bay" },
    { "marker": "D", "id": "fore",    "name": "Fore bay" }
  ],
  "default_loadout": {
    "modules": {
      "cockpit": "rijay.cockpit.solo_3x1",
      "bay":     "rijay.bay.packet"
    },
    "parts": {
      "engine_port": "rijay.engine.wren_90b",
      "engine_stbd": "rijay.engine.wren_90b"
    }
  },
  "cargo": {
    "capacity": 2,
    "handling": "breakbulk"
  },
  "dock_port_orientation": 90.0,
  "dock_standoff": 8.0
}
