{
  "schema": 3,
  "id": "refit_testbed",
  "name": "Refit testbed",
  "mass": 10.0,
  "slots": [
    {
      "marker": "B",
      "id": "bay",
      "name": "Bay"
    }
  ],
  "decks": [
    {
      "name": "Main",
      "grid": [
        "                  ",
        " .  .  .  .  .  . ",
        "                  ",
        "                  ",
        " .  B  B  B  .  . ",
        "                  ",
        "            #=####",
        " .  .  .  . #q   h",
        "             ## ##",
        "                  ",
        " .  .  .  .  .  . ",
        "                  "
      ]
    }
  ],
  "cargo": {
    "capacity": 4,
    "handling": "breakbulk"
  },
  "dock_standoff": 4.0,
  "default_loadout": {
    "modules": {
      "bay": "refit_testbed.bay.empty"
    }
  }
}
